What is the capital of Alaska?,Juneau,Geography
The Viking spacecraft sent back to Earth photographs and reports about the surface of which planet?,Mars,STEM
Describe in words the exact direction that is 697.5° clockwise from due north?,North north west,STEM
Which NFL position has (on average) the shortest career?,running back,Sports
Where were the Utah Jazz originally located?,new orleans,Sports
What year was the World Wide Web launched in?,1991,STEM
What animal has the highest blood pressure?,giraffe,STEM
Which Queen of England and wife of Henry VIII had six fingers on one of her hands?,anne boleyn,History
What was the former name of Times Square before it was renamed in 1904?,longacre square,History
